{
  "schema_version": "0.1.0-draft",
  "assessment_id": "eval-20261025-synthetic-001",
  "evaluator_auth": {
    "execution_context": "SYNTHETIC_MOCK_UNTRUSTED",
    "is_synthetic_mock": true,
    "signature_reference": "UNAUTHENTICATED_SYNTHETIC_FIXTURE"
  },
  "engine": {
    "name": "Evidence-Checkpoint-Engine",
    "version": "0.1.0-draft",
    "canonicalization_standard": "RFC8785",
    "build_commit": "bead6837e1ec03c8fe1ac3c8d09fd374fb8b0e02"
  },
  "evaluation_timestamp": "2026-10-25T03:40:00Z",
  "evaluated_target": {
    "repository_id": "1432704795",
    "repository_owner": "ErenTahiroglu",
    "repository_name": "Evidence-Checkpoint-Engine",
    "target_commit_sha": "bead6837e1ec03c8fe1ac3c8d09fd374fb8b0e02",
    "evaluated_checkpoint_id": "ece-bootstrap-00-baseline"
  },
  "dimensions": {
    "evidence_integrity": {
      "status": "NOT_EVALUATED",
      "digest_match": false,
      "details": "Synthetic illustrative output: engine not executed; digest calculation simulated for contract schema demonstration."
    },
    "ci_execution": {
      "status": "NOT_APPLICABLE",
      "expected_jobs_count": 0,
      "observed_jobs_count": 0,
      "unresolved_jobs": []
    },
    "evidence_availability": {
      "status": "NOT_PROVIDED",
      "expired_references": []
    },
    "review_status": {
      "status": "STATIC_PASS_WITH_LIMITATIONS",
      "tier": "STATIC_AUDIT",
      "scope": "Bootstrap documentation, licensing, and governance static review.",
      "reviewer_identity": "Independent Red Team Reviewer"
    },
    "authorization": {
      "status": "AUTHORIZATION_PENDING",
      "decision_by": null,
      "authorization_scope": "Pending formal owner promotion decision."
    },
    "freshness": {
      "status": "HISTORICAL_BASELINE",
      "live_head_sha": "bead6837e1ec03c8fe1ac3c8d09fd374fb8b0e02"
    }
  },
  "derived_summary": {
    "verdict": "ASSESSED_LIMITATIONS",
    "blocking_reasons": [],
    "warnings": [
      "SYNTHETIC_MOCK: This assessment record is an unverified contract demonstration fixture and does not constitute genuine engine-evaluated evidence.",
      "Repository is at bootstrap baseline; no functional CI execution was evaluated (documentation-only milestone).",
      "Human owner authorization is pending."
    ]
  },
  "claims_breakdown": {
    "source_declared": {
      "claimed_phase": "BOOTSTRAP-00",
      "claimed_producer": "Eren Tahiroğlu"
    },
    "machine_assessed": {
      "sha_verified": false,
      "repo_id_matched": true,
      "schema_conformant": true,
      "digest_verified": false
    },
    "independently_reviewed": {
      "review_verdict": "BOOTSTRAP_00_STATIC_REVIEW_PASS_WITH_LIMITATIONS"
    },
    "human_authorized": {
      "authorized": false
    }
  },
  "checks_performed": [
    "JSON Schema Draft 2020-12 structural syntax parsing (contract fixture verification only)"
  ],
  "checks_omitted": [
    "Functional engine execution (no verification engine compiled or executed in GOV-00 milestone)",
    "Cryptographic digest calculation against live repository object database",
    "CI workflow run verification (no CI workflow configured for BOOTSTRAP-00)",
    "Live GitHub REST API authentication and repository owner validation"
  ],
  "exit_code": 1
}
